movie_id,title,original_title,overview,tagline,status,release_date,runtime,budget,revenue,popularity,vote_average,vote_count,original_language,genres,production_countries,imdb_id
949,Heat,Heat,Obsessive master thief Neil McCauley leads a top-notch crew on various daring heists throughout Los Angeles while determined detective Vincent Hanna pursues him without rest. Each man recognizes and respects the ability and the dedication of the other even though they are aware their cat-and-mouse game may end in violence.,A Los Angeles crime saga.,Released,1995-12-15,170,60000000,187400000,17.3307,7.929,8140,en,Crime|Drama|Action,US,tt0113277
234,The Cabinet of Dr. Caligari,Das Cabinet des Dr. Caligari,"Francis, a young man, recalls in his memory the horrible experiences he and his fiancée Jane recently went through. Francis and his friend Alan visit The Cabinet of Dr. Caligari, an exhibit where the mysterious doctor shows the somnambulist Cesare, and awakens him for some moments from his death-like sleep.",You must become Caligari!,Released,1920-02-27,77,18000,8811,10.7287,7.928,1737,de,Drama|Horror|Thriller|Crime,DE,tt0010323
489412,It's Such a Beautiful Day,It's Such a Beautiful Day,Bill struggles to put together his shattered psyche.,,Released,2012-08-24,62,0,0,0.9747,7.9,364,en,Animation|Comedy,US,tt2396224
180147,We Are the Nobles,Nosotros los nobles,"Tells the ""riches to rags"" story of the Nobles, three upper-class twenty-somethings that appear to have no limits to their checkbooks, and no direction in their lives. Until one day, their father tries to teach them a lesson by staging a financial scandal that forces the whole family to escape to an old house in the poor side of town, and leads the ""kids"" to do what they haven't done before: get jobs.",,Released,2013-03-28,108,2000000,26433651,1.4303,7.927,528,es,Comedy,MX,tt2222394
315465,The Boy and the Beast,バケモノの子,"Kyuta, a boy living in Shibuya, and Kumatetsu, a lonesome beast from Jutengai, an imaginary world. One day, Kyuta forays into the imaginary world and, as he's looking for his way back, meets Kumatetsu who becomes his spirit guide. That encounter leads them to many adventures.","In a world of beasts, he found a family.",Released,2015-07-11,119,0,49714378,4.9389,7.9,1576,ja,Action|Adventure|Animation|Drama|Family|Fantasy,JP,tt4272866
160885,Tel chi el telùn,Tel chi el telùn,A comedy show.,,Released,1999-05-12,120,0,0,0.2343,7.925,335,it,Comedy,IT,tt2626902
1084736,The Count of Monte Cristo,Le Comte de Monte-Cristo,"Edmond Dantès becomes the target of a sinister plot and is arrested on his wedding day for a crime he did not commit. After 14 years in the island prison of Château d’If, he manages a daring escape. Now rich beyond his dreams, he assumes the identity of the Count of Monte-Cristo and exacts his revenge on the three men who betrayed him.","This is not vengeance, this is justice.",Released,2024-06-28,178,46000000,75360860,9.9314,7.924,1965,fr,Adventure|Action|Drama,FR|BE,tt26446278
447365,Guardians of the Galaxy Vol. 3,Guardians of the Galaxy Vol. 3,"Peter Quill, still reeling from the loss of Gamora, must rally his team around him to defend the universe along with protecting one of their own. A mission that, if not completed successfully, could quite possibly lead to the end of the Guardians as we know them.",Once more with feeling.,Released,2023-05-03,150,250000000,845550000,13.9353,7.923,8074,en,Science Fiction|Adventure|Action,US,tt6791350
142061,"Batman: The Dark Knight Returns, Part 2","Batman: The Dark Knight Returns, Part 2",Batman has stopped the reign of terror that The Mutants had cast upon his city.  Now an old foe wants a reunion and the government wants The Man of Steel to put a stop to Batman.,Justice returns... vengeance returns... redemption comes to Gotham.,Released,2013-01-03,78,3500000,0,5.7267,7.923,1576,en,Science Fiction|Action|Animation|Mystery,US,tt2166834
9323,Ghost in the Shell,GHOST IN THE SHELL,"In the year 2029, the barriers of our world have been broken down by the net and by cybernetics, but this brings new vulnerability to humans in the form of brain-hacking. When a highly-wanted hacker known as 'The Puppetmaster' begins involving them in politics, Section 9, a group of cybernetically enhanced cops, are called in to investigate and stop the Puppetmaster.",It found a voice... Now it needs a body.,Released,1995-11-18,83,3000000,10000000,11.5786,7.923,3788,ja,Action|Animation|Science Fiction,JP|GB,tt0113568
8290,Don't Look Now... We're Being Shot At!,La Grande Vadrouille,"During World War II, two French civilians and a downed British Bomber Crew set out from Paris to cross the demarcation line between Nazi-occupied Northern France and the South. From there they will be able to escape to England. First, they must avoid German troops – and the consequences of their own blunders.",,Released,1966-12-08,132,0,0,3.6307,7.923,1445,fr,Comedy|War,FR|GB,tt0060474
13398,Tokyo Godfathers,東京ゴッドファーザーズ,"On Christmas Eve, three homeless people living on the streets of Tokyo discover a newborn baby among the trash and set out to find its parents.",Meet the ultimate dysfunctional family.,Released,2003-12-05,92,0,607735,3.675,7.923,1478,ja,Animation|Drama|Comedy,JP,tt0388473
85,Raiders of the Lost Ark,Raiders of the Lost Ark,"When Dr. Indiana Jones – the tweed-suited professor who just happens to be a celebrated archaeologist – is hired by the government to locate the legendary Ark of the Covenant, he finds himself up against the entire Nazi regime.",The return of the great adventure.,Released,1981-06-12,115,18000000,389925971,12.5511,7.922,13438,en,Adventure|Action,US,tt0082971
1646,Freedom Writers,Freedom Writers,"A young teacher inspires her class of at-risk students to learn tolerance, apply themselves, and pursue education beyond high school.",Their story. Their world. Their future.,Released,2007-01-05,123,21000000,43095175,10.1282,7.921,2380,en,Crime|Drama,DE|US,tt0463998
296096,Me Before You,Me Before You,"Lou Clark, a directionless 26-year-old from the English countryside, takes a job at the local castle as a caregiver and companion to a wealthy young banker, Will Traynor. Wheelchair-bound from an accident two years prior, the once adventurous Will has all but given up — that is until Lou determines to show him that life is worth living.",Live boldly.,Released,2016-06-01,110,20000000,207945075,14.5364,7.919,13088,en,Drama|Romance,US,tt2674426
10404,Raise the Red Lantern,大红灯笼高高挂,"In 1920s China, 19-year-old Songlian becomes a concubine of a powerful lord and is forced to compete with his three wives for the privileges gained.","China, 1920. One Master, Four Wives.",Released,1991-12-18,125,1000000,16600000,1.9579,7.9,784,zh,Drama,CN|HK|TW,tt0101640
152532,Dallas Buyers Club,Dallas Buyers Club,"Loosely based on the true-life tale of Ron Woodroof, a drug-taking, women-loving, homophobic man who in 1986 was diagnosed with HIV/AIDS and given thirty days to live.",Dare to live.,Released,2013-11-01,117,5000000,55736588,4.0956,7.918,8948,en,Drama|History,US,tt0790636
38360,The Cranes Are Flying,Летят журавли,"Veronika and Boris come together in Moscow shortly before World War II. Walking along the river, they watch cranes fly overhead, and promise to rendezvous before Boris leaves to fight. Boris misses the meeting and is off to the front lines, while Veronika waits patiently, sending letters faithfully. After her house is bombed, Veronika moves in with Boris' family, into the company of a cousin with his own intentions.",The compelling story of a girl's impassioned search for happiness.,Released,1957-10-12,97,0,0,4.5049,7.918,441,ru,Drama|Romance|War,SU,tt0050634
11010,The Postman,Il postino,Simple Italian postman learns to love poetry while delivering mail to a famous poet; he uses this to woo local beauty Beatrice.,Dreams do come true.,Released,1994-09-22,114,3000000,33000000,1.2068,7.917,1199,it,Comedy|Drama|Romance,BE|FR|IT,tt0110877
961,The General,The General,"During America’s Civil War, Union spies steal engineer Johnny Gray's beloved locomotive, 'The General'—with Johnnie's lady love aboard an attached boxcar—and he single-handedly must do all in his power to both get The General back and to rescue Annabelle.","Buster drives ""The General"" to trainload of laughter.",Released,1926-12-25,79,750000,1000000,3.0015,7.917,1385,en,Action|Adventure|Comedy|War|Romance,US,tt0017925
770,Gone with the Wind,Gone with the Wind,The spoiled daughter of a Georgia plantation owner conducts a tumultuous romance with a cynical profiteer during the American Civil War and Reconstruction Era.,The greatest romance of all time!,Released,1939-12-15,233,4000000,402352579,8.1384,7.916,4320,en,Drama|War|Romance,US,tt0031381
194,Amélie,Le Fabuleux Destin d'Amélie Poulain,"At a tiny Parisian café, the adorable yet painfully shy Amélie accidentally discovers a gift for helping others. Soon Amelie is spending her days as a matchmaker, guardian angel, and all-around do-gooder. But when she bumps into a handsome stranger, will she find the courage to become the star of her very own love story?",She’ll change your life.,Released,2001-04-25,122,10000000,173921954,11.2913,7.916,12252,fr,Comedy|Romance,FR|DE,tt0211915
18438,Castaway on the Moon,김씨 표류기,"Mr. Kim is jobless, lost in debt and has been dumped by his girlfriend. He decides to end it all by jumping into the Han River – only to find himself washed up on a small, mid-river island. He soon abandons thoughts of suicide or rescue and begins a new life as a castaway. His antics catch the attention of a young woman whose apartment overlooks the river. Her discovery changes both their lives.","Once in a life time, There comes a moment that you live in HOPE.",Released,2009-05-14,119,0,0,4.1338,7.915,727,ko,Drama|Comedy|Romance,KR,tt1499666
3777,Throne of Blood,蜘蛛巣城,"Returning to their lord's castle, samurai warriors Washizu and Miki are waylaid by a spirit who predicts their futures. When the first part of the spirit's prophecy comes true, Washizu's scheming wife, Asaji, presses him to speed up the rest of the spirit's prophecy by murdering his lord and usurping his place. Director Akira Kurosawa's resetting of William Shakespeare's ""Macbeth"" in feudal Japan is one of his most acclaimed films.",,Released,1957-01-15,108,0,13422,4.1029,7.914,961,ja,Drama|History,JP,tt0050613
378108,In This Corner of the World,この世界の片隅に,"Japan, 1943, during World War II. Young Suzu leaves her village near Hiroshima to marry and live with her in-laws in Kure, a military harbor. Her creativity to overcome deprivation quickly makes her indispensable at home. Inhabited by an ancestral wisdom, Suzu impregnates the simple gestures of everyday life with poetry and beauty. The many hardships, the loss of loved ones, the frequent air raids of the enemy, nothing alters her enthusiasm…",Torn apart by war. Brought together by love.,Released,2016-11-12,130,0,19496308,3.5589,7.911,612,ja,Drama|Animation|Romance|War|History,JP,tt4769824
51482,Death Note Relight 1: Visions of a God,DEATH NOTE リライト ～幻視する神～,"When rogue shinigami Ryuk leaves his Death Note in the human world, he has no idea how far the one who finds it will take his new-found power. With the Death Note in hand, brilliant high school student Light Yagami vows to rid the world of evil. A recap of Death Note episodes 1–26, with alternate footage.",,Released,2007-08-31,131,0,0,4.417,7.911,380,ja,TV Movie|Crime|Drama|Fantasy|Thriller|Animation,JP,tt3355694
150540,Inside Out,Inside Out,"When 11-year-old Riley moves to a new city, her Emotions team up to help her through the transition. Joy, Fear, Anger, Disgust and Sadness work together, but when Joy and Sadness get lost, they must journey through unfamiliar places to get back home.",Meet the little voices inside your head.,Released,2015-06-17,95,175000000,857611174,15.837,7.91,23231,en,Animation|Family|Adventure|Drama|Comedy,US,tt2096673
1439112,Muzzle: City of Wolves,Muzzle: City of Wolves,"LAPD officer Jake Rosser endeavors to lead a peaceful life with his family and retired K-9 officer, Socks. However, tranquility dissolves into chaos when a gang targets them in a brutal attack. Alongside his new K-9 partner Argos, Jake launches into a relentless pursuit of justice, determined to protect his loved ones.",Revenge has a new breed.,Released,2025-11-13,93,0,0,34.5313,6.707,111,en,Action|Thriller|Mystery,US,tt32395062
804370,Arco,Arco,"10-year-old Arco lives in a far future. During his first flight in his rainbow suit, he loses control and falls into the past. Iris, a girl his age from 2075, comes to his rescue and tries by all means to help send him back to his era.",What if rainbows were people from the future traveling in time?,Released,2025-10-22,89,10000000,4570178,34.0477,7.532,111,fr,Animation|Adventure|Fantasy|Family|Drama|Science Fiction,FR|US,tt14883538
1428862,Firebreak,Cortafuego,"Little Lide disappears in the forest while her family packs up their home. As a fire breaks out, her mother must race to reach her before the flames do.",,Released,2026-02-19,107,0,0,28.5804,6.204,76,es,Thriller|Drama,ES,tt33474179
1422562,The Moment,The Moment,"A rising pop sensation navigates fame and industry pressures while preparing for her arena tour debut, revealing the transformation of underground culture into mainstream success.",and it's a movie about brat and charli and a tour but none of it happened but maybe some of it did.,Released,2026-01-30,103,4000000,3804949,28.2587,5.9,27,en,Music|Comedy,US,tt35524793
1243460,Joe's College Road Trip,Joe's College Road Trip,"To teach his sheltered grandson about the real world, Madea's foul-mouthed brother Joe takes the college-bound teen on a raucous cross-country road trip.",This ain't no field trip.,Released,2026-02-12,109,0,0,27.1007,5.7,49,en,Comedy,US,tt33603921
338969,The Toxic Avenger Unrated,The Toxic Avenger Unrated,"When a downtrodden janitor, Winston Gooze, is exposed to a catastrophic toxic accident, he’s transformed into a new kind of hero: The Toxic Avenger. Now, Toxie must rise from outcast to savior, taking on ruthless corporate overlords and corrupt forces who threaten his son, his friends, and his community.",The hero we need now.,Released,2025-08-28,102,0,3328938,17.8695,5.986,316,en,Action|Comedy|Science Fiction,US,tt1633359
1318417,A Place for Her,La maison des femmes,"At the Maison des Femmes, women victims of violence are cared for. Elsewhere, they are threatened, brutalized, raped, mutilated, their suffering ignored. Here, they are listened to, supported, helped and believed. Diane, Manon, Inès, Awa and the others will give them a helping hand until they can stand up again. As a team. Even if it means risking their own equilibrium.",,Released,2026-03-01,110,0,0,12.3437,8.9,15,fr,Drama,FR,tt35455708
639988,No Other Choice,어쩔수가없다,"After being laid off and humiliated by a ruthless job market, a veteran paper mill manager descends into violence in a desperate bid to reclaim his dignity.",Would you kill for a job?,Released,2025-09-24,139,12200000,37154602,18.5895,7.551,788,ko,Comedy|Crime|Thriller,KR|FR,tt1527793
1443940,Truth & Treason,Truth & Treason,"When loyalty to country becomes loyalty to a lie, one teen risks everything to expose the truth. With the Gestapo closing in, he must decide what it really means to be a good German.",His defiance will never be silenced.,Released,2025-10-16,121,15000000,6045655,15.1221,8.036,42,en,History|Drama|Thriller,US,tt21825416
1231052,KitKatClub: Kinks of Berlin,KitKatClub: Kinks of Berlin,"The story of the legendary Berlin club and its founder, a woman whose life is inextricably interwoven with the bright and dark sides of a hedonistic lifestyle.",,In Production,2026-03-06,96,0,0,17.2382,0.0,0,de,Documentary,AT|DE,tt40445453
1386827,Coyotes,Coyotes,"Trapped in their Hollywood Hills home, a family fights for survival when caught between a raging wildfire and a pack of savage coyotes.",Eat the rich.,Released,2025-10-02,91,0,0,16.2642,5.5,49,en,Horror|Comedy,US|GB|CO,tt34581826
1160360,If I Had Legs I'd Kick You,If I Had Legs I'd Kick You,"With her life crashing down around her, Linda attempts to navigate her child's mysterious illness, her absent husband, a missing person, and an increasingly hostile relationship with her therapist.",Everything is under control.,Released,2025-10-10,113,1500000,1346808,17.1391,6.362,224,en,Drama,US,tt18382850
467905,How to Make a Killing,How to Make a Killing,"Disowned at birth by his obscenely wealthy family, blue-collar Becket Redfellow will stop at nothing to reclaim his inheritance, no matter how many relatives stand in his way.",$28 billion inheritance. 7 relatives standing in the way.,Released,2026-02-19,105,40000000,7124130,16.9323,6.8,26,en,Comedy|Thriller,GB|FR|ZA,tt4357198
8966,Twilight,Twilight,"When Bella Swan moves to a small town in the Pacific Northwest, she falls in love with Edward Cullen, a mysterious classmate who reveals himself to be a 108-year-old vampire. Despite Edward's repeated cautions, Bella can't stay away from him, a fatal move that endangers her own life.","When you can live forever, what do you live for?",Released,2008-11-20,122,37000000,393616788,16.8451,6.28,14251,en,Fantasy|Drama|Romance,GB|US,tt1099212
1354518,100 Nights of Hero,100 Nights of Hero,"When a charming house guest arrives at a remote castle, the delicate dynamic between a neglectful husband, his innocent bride Cherry and their devoted maid Hero is thrown into chaos.",Whatever the lady wants.,Released,2025-12-05,91,0,0,12.0739,5.7,15,en,Fantasy|Romance,GB|US,tt33350512
1408208,Exit 8,８番出口,"A man becomes increasingly desperate when he realizes he is trapped in a subway station, needing to complete a mission to get out.",Turn back.,Released,2025-08-28,95,0,33100990,18.4407,6.388,219,ja,Horror|Mystery,JP,tt35222590
1159206,Father Mother Sister Brother,Father Mother Sister Brother,"Estranged siblings reunite after years apart, forced to confront unresolved tensions and reevaluate their strained relationships with their emotionally distant parents.",,Released,2025-12-01,110,0,2000000,11.5068,6.581,173,en,Comedy|Drama,US|FR|IE|IT|DE|GB,tt31189315
1327688,One Mile: Chapter One,One Mile: Chapter One,"After being released from prison, a father tries to reconnect with his daughter by taking her on a tour of college, but they soon find themselves fighting for more than their lost relationship when a murderous cult pursues them.",,Released,2026-02-20,86,0,0,16.2782,7.2,44,en,Action|Crime,US|CA,tt24326458
1433842,Relationship Goals,Relationship Goals,"When TV producer Leah Caldwell aims to become the first woman running New York's top morning show, her ex competes for the same role. Leah stays focused on her career, until chemistry with her ex challenges her priorities.",Work just got complicated.,Released,2026-02-04,96,0,0,18.2623,5.6,50,en,Romance|Comedy,US,tt35718349
1398486,Maigret and the Dead Lover,Maigret et le mort amoureux,"Commissioner Maigret rushes to the Quai d’Orsay with Lieutenant Janvier. There, they find Mademoiselle Larrieu in a state of shock. That very morning, she discovered the bullet-riddled body of Mr. Berthier-Lagès, a renowned former ambassador whom she had served as a housekeeper for 46 years. While searching the victim's apartment, Maigret and Janvier uncover hundreds of letters. The diplomat had maintained a fifty-year-long love correspondence with a certain Princess of Vuynes, whose husband - by a strange coincidence - had died just a few days earlier. As he confronts the various members of the two families and the suspicious silence of Mademoiselle Larrieu, Maigret finds himself faced with surprise after surprise, watching his certainties crumble - until the solution to the mystery finally hits him in the face at the very last moment...",,Released,2026-02-18,80,0,0,14.6806,6.1,12,fr,Crime|Mystery,FR|BE,tt33509147
1560852,For a while,Per un po',"Niccolò, a forty-year-old man with a successful career and a desire to give back some of what he has received in his life, becomes the foster father of Federico, an eighteen-year-old with a difficult past who grew up in a community. A deep and complex relationship begins to develop between them, an emotional rollercoaster that never quite manages to find true balance.",,Released,2026-02-12,100,0,0,10.3211,0.0,0,it,Drama,,tt26720806
1151272,Sirāt,Sirāt,"A man and his son arrive at a rave lost in the mountains of Morocco. They are looking for Marina, their daughter and sister, who disappeared months ago at another rave. Driven by fate, they decide to follow a group of ravers in search of one last party, in hopes Marina will be there.",,Released,2025-06-06,115,7000000,10445082,15.6496,6.825,525,es,Drama|Thriller,ES|FR,tt32298285
682012,Little Amélie or the Character of Rain,Amélie et la métaphysique des tubes,"The world is a perplexing, peaceful mystery to Amélie until a miraculous encounter with chocolate ignites her wild sense of curiosity. As she develops a deep attachment to her family's housekeeper, Nishio-san, Amélie discovers the wonders of nature as well as the emotional truths hidden beneath the surface of her family's idyllic life as foreigners in post-war Japan.","When you're three years old, you see everything and understand nothing.",Released,2025-06-25,78,11100000,1530750,15.54,8.0,114,fr,Animation|Drama|Family,FR,tt29313285
1263012,Dead Man's Wire,Dead Man's Wire,"In 1977, former real estate developer Tony Kiritsis puts a dead man's switch on himself and the mortgage banker who did him wrong, demanding $5 million and a personal apology.",His revolution was televised.,Released,2025-10-25,105,13000000,2248569,15.4527,6.5,67,en,Crime|Drama,US|IL|BE|CY|DE,tt15181326
1317149,I Swear,I Swear,"Diagnosed with Tourette Syndrome at 15, John Davidson navigates his way against the odds through troubled teenage years and into adulthood, finding inspiration in the kindness of others to discover his true purpose in life.",I blink. I twitch. I jump. I click. I whistle. I shout.,Released,2025-09-22,120,6000000,8390131,15.4085,8.272,101,en,Drama|History,GB|IE,tt31514146
1131759,Omniscient Reader: The Prophecy,전지적 독자 시점,"Kim Dok-ja, an ordinary man in his 20s, is the only reader of an obscure web novel titled ""Three Ways to Survive the Apocalypse"". After having read the last chapter, the novel suddenly becomes reality, and its omnipotent hero Yu Jung-hyeok appears before Kim. As the only person who knows how to survive in this world, Kim and his companions strive to save the world by writing his own, new ending.",A novel known only by me has become reality.,Released,2025-07-23,117,0,9187679,15.2092,6.8,75,ko,Action|Adventure|Fantasy,KR,tt30254719
1602705,A Letter to My Youth,Surat untuk Masa Mudaku,A rebellious teen and a reserved caretaker form an unlikely bond in an orphanage as they come to terms with their painful pasts.,,Released,2026-01-29,135,0,0,15.1312,7.4,17,id,Drama,ID,tt39240255
1412598,Killer Whale,Killer Whale,Follows best friends Maddie and Trish as they find themselves trapped in a remote lagoon with the dangerous killer whale named Ceto.,It's feeding time.,Released,2026-01-16,89,0,0,14.9807,5.6,64,en,Thriller|Horror|Action|Mystery|Science Fiction,AU|US|GB,tt33479805
1445363,EPiC: Elvis Presley in Concert,EPiC: Elvis Presley in Concert,"Long-lost footage from Elvis Presely's legendary Las Vegas residency in the 1970s woven together with rare 16mm footage from Elvis on Tour, and 8mm from the Graceland archive, plus recordings of Elvis telling ""his side of the story"" rediscovered during Baz Luhrmann's research for his 2022 film, Elvis.",Elvis sings and tells his story like never before.,Released,2026-02-18,98,0,7800000,14.9148,8.152,23,en,Music|Documentary,US|AU,tt35003538
1503900,Die'ced: Reloaded,Die'ced: Reloaded,"Benny escapes an asylum on Halloween, masked as a scarecrow and hungry for blood. In 1980s Seattle, the hunt is on - and no one is safe.",Meet Benny. The new face of eveil.,Released,2025-08-08,81,0,58558,14.8904,5.4,9,en,Horror|Thriller,US,tt36748605
1618945,Yoh! Bestie,Yoh! Bestie,"Thando is perpetually unlucky in love, but when her bestie returns from his travels with a fiancée in tow, she's forced to face a new emotion — jealousy.",,Released,2026-02-06,95,0,0,14.7858,6.25,36,en,Romance|Comedy,ZA,tt39354078
1456349,It Was Just an Accident,Un simple accident,An unassuming mechanic is reminded of his time in an Iranian prison when he encounters a man he suspects to be his sadistic jailhouse captor.,,Released,2025-10-01,104,6000000,9602793,14.4561,7.182,414,fr,Drama|Thriller|Crime|Mystery,IR|FR|LU,tt36491653
1266805,The Musicians,Les Musiciens,"Astrid Thompson finally succeeds in fulfilling her father's dream: to bring together four Stradivarius for a unique concert, eagerly expected by music lovers around the world. But Lise, George, Peter and Apolline, the four virtuosos recruited for the occasion, are incapable of playing together. The rehearsals are one ego crisis after another. With no solution in sight, Astrid decides to go and find the only person who, in her eyes, can still save the event: Charlie Beaumont, the composer of the score.",,Released,2025-05-07,102,0,0,14.2739,6.4,42,fr,Drama|Music|Comedy,FR,tt35344083
1241983,Train Dreams,Train Dreams,A logger leads a life of quiet grace as he experiences love and loss during an era of monumental change in early 20th-century America.,The extraordinary story of an ordinary life.,Released,2025-11-05,102,10000000,0,13.898,7.332,797,en,Drama,US,tt29768334
