movie_id,title,original_title,overview,tagline,status,release_date,runtime,budget,revenue,popularity,vote_average,vote_count,original_language,genres,production_countries,imdb_id
441130,Wolfwalkers,Wolfwalkers,"In a time of superstition and magic, when wolves are seen as demonic and nature an evil to be tamed, a young apprentice hunter comes to Ireland with her father to wipe out the last pack. But when she saves a wild native girl, their friendship leads her to discover the world of the Wolfwalkers and transform her into the very thing her father is tasked to destroy.",Be fierce. Be wild. Be free.,Released,2020-10-26,102,12000000,1310720,4.5363,8.194,1348,en,Animation|Family|Adventure|Fantasy,FR|IE|LU|US|CN,tt5198068
313106,Doctor Who: The Day of the Doctor,Doctor Who: The Day of the Doctor,"In 2013, something terrible is awakening in London's National Gallery; in 1562, a murderous plot is afoot in Elizabethan England; and somewhere in space an ancient battle reaches its devastating conclusion. All of reality is at stake as the Doctor's own dangerous past comes back to haunt him.",,Released,2013-11-23,77,0,10000000,2.6684,8.191,766,en,Science Fiction|Adventure,GB,tt2779318
324786,Hacksaw Ridge,Hacksaw Ridge,"WWII American Army Medic Desmond T. Doss, who served during the Battle of Okinawa, refuses to kill people and becomes the first Conscientious Objector in American history to receive the Congressional Medal of Honor.",One of the greatest heroes in American history never fired a bullet.,Released,2016-10-07,139,40000000,175302354,12.1113,8.19,14641,en,Drama|History|War,AU|GB|US,tt2119532
284,The Apartment,The Apartment,"Bud Baxter is a minor clerk in a huge New York insurance company, until he discovers a quick way to climb the corporate ladder. He lends out his apartment to the executives as a place to take their mistresses. Although he often has to deal with the aftermath of their visits, one night he's left with a major problem to solve.","Movie-wise, there has never been anything like it - laugh-wise, love-wise, or otherwise-wise!",Released,1960-06-21,125,3000000,25000000,9.0667,8.189,2590,en,Comedy|Drama|Romance,US,tt0053604
290098,The Handmaiden,아가씨,"1930s Korea, in the period of Japanese occupation, a new girl, Sookee, is hired as a handmaiden to a Japanese heiress, Hideko, who lives a secluded life on a large countryside estate with her domineering Uncle Kouzuki. But the maid has a secret. She is a pickpocket recruited by a swindler posing as a Japanese Count to help him seduce the Lady to steal her fortune.",You're the one being tricked.,Released,2016-06-01,145,8575000,38600000,14.3497,8.188,4212,ko,Thriller|Drama|Romance,KR,tt4016934
620683,My Mom Is a Character 3,Minha Mãe é uma Peça 3: O Filme,Dona Hermínia will have to rediscover and reinvent herself because her children are forming new families. This supermom will have to deal with a new life scenario: Marcelina is pregnant and Juliano is getting married.,,Released,2019-12-26,111,2000000,39273021,0.5414,8.182,493,pt,Comedy,BR,tt10611372
185,A Clockwork Orange,A Clockwork Orange,"In a near-future Britain, young Alexander DeLarge and his pals get their kicks beating and raping anyone they please. When not destroying the lives of others, Alex swoons to the music of Beethoven. The state, eager to crack down on juvenile crime, gives an incarcerated Alex the option to undergo an invasive procedure that'll rob him of all personal agency. In a time when conscience is a commodity, can Alex change his tune?","Being the adventures of a young man whose principal interests are rape, ultra-violence and Beethoven.",Released,1971-10-28,137,2200000,27033812,8.9086,8.179,13654,en,Science Fiction|Crime,GB,tt0066921
77,Memento,Memento,"Leonard Shelby is tracking down the man who raped and murdered his wife. The difficulty of locating his wife's killer, however, is compounded by the fact that he suffers from a rare, untreatable form of short-term memory loss. Although he can recall details of life before his accident, Leonard cannot remember what happened fifteen minutes ago, where he's going, or why.",Some memories are best forgotten.,Released,2000-10-11,113,9000000,40060108,12.1372,8.176,15969,en,Mystery|Thriller,US,tt0209144
522924,The Art of Racing in the Rain,The Art of Racing in the Rain,"A family dog – with a near-human soul and a philosopher's mind – evaluates his life through the lessons learned by his human owner, a race-car driver.",Meet the dog who will show the world how to be human.,Released,2019-08-08,109,18000000,33800000,8.0653,8.173,1648,en,Drama|Romance,US,tt1478839
537061,Steven Universe: The Movie,Steven Universe: The Movie,"Two years after bringing peace to the galaxy, Steven Universe sees his past come back to haunt him in the form of a deranged Gem who wants to destroy the Earth.",The true kinda love.,Released,2019-10-07,83,0,0,2.2365,8.2,842,en,TV Movie|Animation|Family|Adventure|Fantasy,US,tt10515852
5156,Bicycle Thieves,Ladri di biciclette,"Unemployed Antonio is elated when he finally finds work hanging posters around war-torn Rome. However on his first day, his bicycle—essential to his work—gets stolen. His job is doomed unless he can find the thief. With the help of his son, Antonio combs the city, becoming desperate for justice.",The Prize Picture They Want to Censor!,Released,1948-07-21,89,133000,450159,8.6493,8.169,2613,it,Drama,IT,tt0040522
629,The Usual Suspects,The Usual Suspects,"Held in an L.A. interrogation room, Verbal Kint attempts to convince the feds that a mythic crime lord, Keyser Soze, not only exists, but was also responsible for drawing him and his four partners into a multi-million dollar heist that ended with an explosion in San Pedro harbor – leaving few survivors. Verbal lures his interrogators with an incredible story of the crime lord's almost supernatural prowess.",Five criminals. One line up. No coincidence.,Released,1995-07-19,106,6000000,23300000,10.6725,8.169,11211,en,Drama|Crime|Thriller,US,tt0114814
26451,Investigation of a Citizen Above Suspicion,Indagine su un cittadino al di sopra di ogni sospetto,"Rome, Italy. After committing a heinous crime, a senior police officer exposes evidence incriminating him because his moral commitment prevents him from circumventing the law and the social order it protects.",,Released,1970-10-16,111,0,0,4.8233,8.168,856,it,Drama|Thriller,IT,tt0065889
18148,Tokyo Story,東京物語,"The elderly Shukishi and his wife, Tomi, take the long journey from their small seaside village to visit their adult children in Tokyo. Their elder son, Koichi, a doctor, and their daughter, Shige, a hairdresser, don't have much time to spend with their aged parents, and so it falls to Noriko, the widow of their younger son who was killed in the war, to keep her in-laws company.","As long as life goes on, relationships between parents and children will bring boundless joy and endless grief.",Released,1953-11-03,137,0,0,4.1879,8.167,1198,ja,Drama,JP,tt0046438
348,Alien,Alien,"During its return to the earth, commercial spaceship Nostromo intercepts a distress signal from a distant planet. When a three-member team of the crew discovers a chamber containing thousands of eggs on the planet, a creature inside one of the eggs attacks an explorer. The entire crew is unaware of the impending nightmare set to descend upon them when the alien parasite planted inside its unfortunate host is birthed.",In space no one can hear you scream.,Released,1979-05-25,117,11000000,104931801,16.7451,8.167,16083,en,Horror|Science Fiction,US|GB,tt0078748
490,The Seventh Seal,Det sjunde inseglet,"When disillusioned Swedish knight Antonius Block returns home from the Crusades to find his country in the grips of the Black Death, he challenges Death to a chess match for his life. Tormented by the belief that God does not exist, Block sets off on a journey, meeting up with traveling players Jof and his wife, Mia, and becoming determined to evade Death long enough to commit one redemptive act while he still lives.",The story of a challenge to death.,Released,1957-02-16,96,150000,311212,3.7193,8.161,3289,sv,Fantasy|Drama,SE,tt0050976
1422,The Departed,The Departed,"To take down South Boston's Irish Mafia, the police send in one of their own to infiltrate the underworld, not realizing the syndicate has done likewise. While an undercover cop curries favor with the mob kingpin, a career criminal rises through the police ranks. But both sides soon discover there's a mole among them.","Cops or criminals. When you’re facing a loaded gun, what’s the difference?",Released,2006-10-04,151,90000000,291465000,16.2562,8.16,15948,en,Drama|Thriller|Crime,HK|US,tt0407887
489,Good Will Hunting,Good Will Hunting,"Will Hunting is a headstrong, working-class genius who is failing the lessons of life. After one too many run-ins with the law, Will's last chance is a psychology professor, who might be the only man who can reach him.","Some people can never believe in themselves, until someone believes in them.",Released,1997-12-05,127,10000000,225900000,12.1406,8.158,13590,en,Drama,US,tt0119217
476292,Maquia: When the Promised Flower Blooms,さよならの朝に約束の花をかざろう,"Fleeing the war, the immortal Machia, graced with eternal youth, finds a baby abandoned in the forest and decides to raise it as her own child, sparking a moving story between a mortal and a being who does not age.",I weave my life with yours.,Released,2018-02-24,115,0,4345395,6.3771,8.155,690,ja,Animation|Fantasy|Drama|Adventure,JP,tt7339826
111,Scarface,Scarface,"After getting a green card in exchange for assassinating a Cuban government official, Tony Montana stakes a claim on the drug trade in Miami. Viciously murdering anyone who stands in his way, Tony eventually becomes the biggest drug lord in the state, controlling nearly all the cocaine that comes through Miami. But increased pressure from the police, wars with Colombian drug cartels and his own drug-fueled paranoia serve to fuel the flames of his eventual downfall.",He loved the American Dream. With a vengeance.,Released,1983-12-09,170,25000000,66023329,17.5552,8.155,12787,en,Action|Crime|Drama,US,tt0086250
399106,Piper,Piper,"A mother bird tries to teach her little one how to find food by herself. In the process, she encounters a traumatic experience that she must overcome in order to survive.",,Released,2016-06-16,6,0,0,5.0639,8.152,1710,en,Family|Animation,US,tt5613056
37165,The Truman Show,The Truman Show,An insurance salesman begins to suspect that his whole life is actually some sort of reality TV show.,On the air. Unaware.,Released,1998-06-04,103,60000000,264118712,15.9792,8.151,19878,en,Comedy|Drama,US,tt0120382
20941,Innocent Voices,Voces inocentes,"A young boy, attempting to have a normal childhood in 1980s El Salvador, is caught up in a dramatic fight for his life when he desperately tries to avoid the war that is raging all around him.",,Released,2005-01-28,120,0,837000,1.7063,8.148,513,es,Drama|War,US|MX|PR,tt0387914
426,Vertigo,Vertigo,"A retired San Francisco detective suffering from acrophobia investigates the strange activities of an old friend's wife, all the while becoming dangerously obsessed with her.",Alfred Hitchcock engulfs you in a whirlpool of terror and tension!,Released,1958-05-09,128,2479000,7808900,8.519,8.146,6238,en,Mystery|Romance|Thriller,US,tt0052357
81481,Silenced,도가니,"Based on actual events that took place at Gwangju Inhwa School for the hearing-impaired, where young deaf students were the victims of repeated sexual assaults by faculty members over a period of five years in the early 2000s.","The hideous truth, concealed far too long.",Released,2011-09-22,125,2200000,31500000,7.0222,8.145,752,ko,Drama,KR,tt2070649
10098,The Kid,The Kid,A tramp cares for a boy after he's abandoned as a newborn by his mother. Later the mother has a change of heart and aches to be reunited with her son.,6 reels of Joy.,Released,1921-01-21,68,250000,5450000,7.2903,8.143,2322,en,Comedy|Drama,US,tt0012349
289,Casablanca,Casablanca,"In Casablanca, Morocco in December 1941, a cynical American expatriate meets a former lover, with unforeseen complications.",They had a date with fate in Casablanca!,Released,1943-01-15,102,878000,10462500,7.2043,8.1,5937,en,Drama|Romance,US,tt0034583
9702,Bound by Honor,Bound by Honor,"Based on the true life experiences of poet Jimmy Santiago Baca, the film focuses on half-brothers Paco and Cruz, and their bi-racial cousin Miklo. It opens in 1972, as the three are members of an East L.A. gang known as the ""Vatos Locos"", and the story focuses on how a violent crime and the influence of narcotics alter their lives. Miklo is incarcerated and sent to San Quentin, where he makes a ""home"" for himself. Cruz becomes an exceptional artist, but a heroin addiction overcomes him with tragic results. Paco becomes a cop and an enemy to his ""carnal"", Miklo.",An epic story of three brothers. Bound by blood. Divided by fate. Driven by destiny.,Released,1993-02-05,180,35000000,4500000,6.3282,8.142,1487,en,Crime|Action|Drama|Thriller,US,tt0106469
851644,20th Century Girl,20세기 소녀,"In 1999, a teen girl keeps close tabs on a boy in school on behalf of her deeply smitten best friend – then she gets swept up in a love story of her own.",A first love pov story.,Released,2022-10-06,119,119,0,8.6839,8.1,795,ko,Romance|Drama,KR,tt15340724
280,Terminator 2: Judgment Day,Terminator 2: Judgment Day,"Ten years after the events of the original, a reprogrammed T-800 is sent back in time to protect young John Connor from the shape-shifting T-1000. Together with his mother Sarah, he fights to stop Skynet from triggering a nuclear apocalypse.",It's nothing personal.,Released,1991-07-03,137,102000000,517778573,14.7,8.14,14005,en,Action|Thriller|Science Fiction,FR|US,tt0103064
517814,Capernaum,کفرناحوم,"After running away from his negligent parents, committing a violent crime and being sentenced to five years in jail, a hardened, streetwise 12-year-old Lebanese boy sues his parents in protest of the life they have given him.",It takes courage to hope.,Released,2018-09-20,126,4000000,64978931,4.7832,8.139,1937,ar,Drama,FR|LB|GB|US,tt8267604
797,Persona,Persona,"A young nurse, Alma, is put in charge of Elisabeth Vogler: an actress who is seemingly healthy in all respects, but will not talk. As they spend time together, Alma speaks to Elisabeth constantly, never receiving any answer.",Ingmar Bergman's most personal and original film.,Released,1966-10-18,84,0,0,2.3995,8.1,2370,sv,Drama,SE,tt0060827
872,Singin' in the Rain,Singin' in the Rain,"In 1927 Hollywood, a silent film star falls for a chorus girl just as he and his paranoid screen partner struggle to make the difficult transition to talking pictures.",What a Glorious Feeling!,Released,1952-04-10,103,2540800,7200000,4.7423,8.136,3431,en,Comedy|Romance,US,tt0045152
3780,Red Beard,赤ひげ,"Aspiring to an easy job as personal physician to a wealthy family, Noboru Yasumoto is disappointed when his first post after medical school takes him to a small country clinic under the gruff doctor Red Beard. Yasumoto rebels in numerous ways, but Red Beard proves a wise and patient teacher. He gradually introduces his student to the unglamorous side of the profession, ultimately assigning him to care for a prostitute rescued from a local brothel.","What is the key to life - power, prestige or peace?",Released,1965-03-04,185,0,0,5.2983,8.1,401,ja,Drama,JP,tt0058888
592350,My Hero Academia: Heroes Rising,僕のヒーローアカデミア THE MOVIE ヒーローズ：ライジング,"Class 1-A visits Nabu Island where they finally get to do some real hero work. The place is so peaceful that it's more like a vacation... until they're attacked by a villain with an unfathomable Quirk! His power is eerily familiar, and it looks like Shigaraki had a hand in the plan. But with All Might retired and citizens' lives on the line, there's no time for questions. Deku and his friends are the next generation of heroes, and they're the island's only hope.","When There's Nothing to be gained, Rising to the challenge at those times, is surely the mark... OF A TRUE HERO!",Released,2019-12-20,104,0,30017163,5.4154,8.1,1251,ja,Animation|Action|Fantasy|Adventure,JP,tt11107074
606856,Togo,Togo,"The untold true story set in the winter of 1925 that takes you across the treacherous terrain of the Alaskan tundra for an exhilarating and uplifting adventure that will test the strength, courage and determination of one man, Leonhard Seppala, and his lead sled dog, Togo.",The untold true story.,Released,2019-12-20,113,0,0,3.3888,8.131,2212,en,Adventure|Family,US,tt5116302
666,Central Station,Central do Brasil,"An emotional journey of a former school teacher, who writes letters for illiterate people, and a young boy, whose mother has just died, as they search for the father he never knew.","Between hope and solitude, two lives cross and reinvent themselves",Released,1998-04-03,111,2900000,5596708,1.4834,8.1,1028,pt,Drama,BR|FR,tt0140888
103,Taxi Driver,Taxi Driver,"Suffering from insomnia, disturbed loner Travis Bickle takes a job as a New York City cabbie, haunting the streets nightly, growing increasingly detached from reality as he dreams of cleaning up the filthy city.","On every street in every city in this country, there's a nobody who dreams of being somebody. He's a lonely forgotten man desperate to prove that he's alive.",Released,1976-02-09,114,1900000,28579636,15.2605,8.127,13241,en,Crime|Drama,US,tt0075314
935,Dr. Strangelove or: How I Learned to Stop Worrying and Love the Bomb,Dr. Strangelove or: How I Learned to Stop Worrying and Love the Bomb,"After the insane General Jack D. Ripper initiates a nuclear strike on the Soviet Union, a war room full of politicians, generals and a Russian diplomat all frantically try to stop it.",The hot-line suspense comedy.,Released,1964-01-29,95,1800000,9500000,6.4044,8.125,6056,en,Comedy|War,GB|US,tt0057012
458220,Palmer,Palmer,"After 12 years in prison, former high school football star Eddie Palmer returns home to put his life back together—and forms an unlikely bond with Sam, an outcast boy from a troubled home. But Eddie's past threatens to ruin his new life and family.",Family is who you make it.,Released,2021-01-28,110,0,0,8.2116,8.123,1864,en,Drama,US|LU,tt6857376
20914,My Friends,Amici miei,Four inseparable friends try to face their midlife crisis with daytrips and pranks at the expense of their families and the people around them.,"They played together, they drank together, they whorekistand together and when the semiwattle was in crispation, they had a boobchik of a time!",Released,1975-10-24,140,0,0,1.4029,8.122,739,it,Comedy,IT,tt0072637
600,Full Metal Jacket,Full Metal Jacket,A pragmatic U.S. Marine observes the dehumanizing effects the U.S.-Vietnam War has on his fellow recruits from their brutal boot camp training to the bloody street fighting in Hue.,"In Vietnam, the wind doesn't blow. It sucks.",Released,1987-06-26,117,30000000,46357676,10.2548,8.12,11274,en,Drama|War,GB|US,tt0093058
575813,Better Days,少年的你,"A bullied teenage girl forms an unlikely friendship with a mysterious young man who protects her from her assailants, while she copes with the pressures of her final examinations.",You protect the world. I'll protect you.,Released,2019-10-25,135,0,225879065,5.4987,8.117,536,zh,Drama|Crime|Romance,CN|HK|GB,tt9586294
500,Reservoir Dogs,Reservoir Dogs,"A botched robbery indicates a police informant, and the pressure mounts in the aftermath at a warehouse. Crime begets violence as the survivors -- veteran Mr. White, newcomer Mr. Orange, psychopathic parolee Mr. Blonde, bickering weasel Mr. Pink and Nice Guy Eddie -- unravel.",Every dog has his day.,Released,1992-09-02,99,1200000,2859750,11.3804,8.116,15211,en,Crime|Thriller,US,tt0105236
1103621,How to Make Millions Before Grandma Dies,หลานม่า,"M, a university dropout low on money and luck, volunteers to take care of his terminally ill grandmother, in the hope of pocketing an inheritance.",Never underestimate a grandma's love for her family.,Released,2024-04-04,126,1000000,73800000,8.9119,8.115,374,th,Drama,TH,tt31392609
810693,Jujutsu Kaisen 0,劇場版 呪術廻戦 0,"Yuta Okkotsu is a nervous high school student who is suffering from a serious problem—his childhood friend Rika has turned into a curse and won't leave him alone. Since Rika is no ordinary curse, his plight is noticed by Satoru Gojo, a teacher at Jujutsu High, a school where fledgling exorcists learn how to combat curses. Gojo convinces Yuta to enroll, but can he learn enough in time to confront the curse that haunts him?",Love is a twisted curse.,Released,2021-12-24,105,0,195870885,12.7871,8.115,1677,ja,Animation|Action|Fantasy,JP,tt14331144
829402,Ultraman: Rising,Ultraman: Rising,"A star athlete reluctantly returns home to take over his father's duties as Ultraman, shielding Tokyo from giant monsters as he becomes a legendary hero.",Big hero. Bigger responsibility.,Released,2024-06-14,117,0,0,9.0679,8.1,368,en,Animation|Science Fiction|Family|Action,JP|US,tt9471678
422,8½,8½,"Guido Anselmi, a film director, finds himself creatively barren at the peak of his career. Urged by his doctors to rest, Anselmi heads for a luxurious resort, but a sorry group gathers—his producer, staff, actors, wife, mistress, and relatives—each one begging him to get on with the show. In retreat from their dependency, he fantasizes about past women and dreams of his childhood.",A picture that goes beyond what men think about - because no man ever thought about it in quite this way!,Released,1963-02-14,139,0,0,2.4353,8.109,2489,it,Drama,IT|FR,tt0056801
406997,Wonder,Wonder,"The story of August Pullman – a boy with facial differences – who enters fifth grade, attending a mainstream elementary school for the first time.",Who gives you the courage to face the world?,Released,2017-11-13,113,20000000,315025930,7.0063,8.107,8183,en,Family|Drama,US,tt2543472
46738,Incendies,Incendies,"A mother's last wishes send twins Jeanne and Simon on a journey to Middle East in search of their tangled roots. Adapted from Wajdi Mouawad's acclaimed play, Incendies tells the powerful and moving tale of two young adults' voyage to the core of deep-rooted hatred, never-ending wars and enduring love.",The search began at the opening of their mother's will.,Released,2010-09-17,131,6800000,6788659,8.6264,8.106,3175,fr,Drama|War|Mystery,CA|FR,tt1255953
531428,Portrait of a Lady on Fire,Portrait de la jeune fille en feu,"On an isolated island in Brittany at the end of the eighteenth century, a female painter is obliged to paint a wedding portrait of a young woman.",Don't regret. Remember.,Released,2019-09-06,121,5740000,9923127,5.5931,8.1,2873,fr,Drama|Romance,FR,tt8613070
38288,"“The Shorts” by Aldo, Giovanni and Giacomo","“I Corti” di Aldo, Giovanni e Giacomo","I Corti (""Shorts"") by Aldo, Giovanni & Giacomo was the first stage show of the comedy trio, with the participation of Marina Massironi. It was recorded live at the Teatro Nuovo in Ferrara on 28 and 29 March 1996. Produced by Agidi, with the theatre direction of Arturo Brachetti.",,Released,1996-03-29,130,0,0,0.2673,8.104,359,it,Comedy,IT,tt3444066
146233,Prisoners,Prisoners,"Keller Dover is facing every parent’s worst nightmare. His six-year-old daughter, Anna, is missing, together with her young friend, Joy, and as minutes turn to hours, panic sets in. The only lead is a dilapidated RV that had earlier been parked on their street.",Every moment matters.,Released,2013-09-19,153,46000000,122126687,12.9406,8.102,12816,en,Drama|Thriller|Crime,US,tt1392214
1398,Stalker,Сталкер,"Near a gray and unnamed city is the Zone, a place guarded by barbed wire and soldiers, and where the normal laws of physics are victim to frequent anomalies. A stalker guides two men into the Zone, specifically to an area in which deep-seated desires are granted.","There's no need to speak. You must only...concentrate and recall all your past life. When a man thinks of the past, he becomes kinder.",Released,1979-05-25,162,120000,0,7.33,8.1,2454,ru,Science Fiction|Drama,SU,tt0079944
103663,The Hunt,Jagten,"A teacher lives a lonely life, all the while struggling over his son’s custody. His life slowly gets better as he finds love and receives good news from his son, but his new luck is about to be brutally shattered by an innocent little lie.",The lie is spreading.,Released,2012-10-25,116,3800000,18300000,10.8313,8.097,4639,da,Drama,DK|SE,tt2106476
600354,The Father,The Father,"A man refuses all assistance from his daughter as he ages and, as he tries to make sense of his changing circumstances, he begins to doubt his loved ones, his own mind and even the fabric of his reality.",,Released,2020-12-23,97,6000000,21029340,8.5817,8.096,3550,en,Drama,FR|GB,tt10272386
100,"Lock, Stock and Two Smoking Barrels","Lock, Stock and Two Smoking Barrels",A card shark and his unwillingly-enlisted friends need to make a lot of cash quick after losing a sketchy poker match. To do this they decide to pull a heist on a small-time gang who happen to be operating out of the flat next door.,A Disgrace to Criminals Everywhere.,Released,1998-08-28,105,1350000,28356188,5.8319,8.096,7079,en,Comedy|Crime,GB|US,tt0120735
823219,Flow,Straume,"A solitary cat, displaced by a great flood, finds refuge on a boat with various species and must navigate the challenges of adapting to a transformed world together.",Disaster tore their world apart. Friendship will bring them together.,Released,2024-08-29,85,3700000,17660107,14.7123,8.095,2672,lv,Animation|Adventure|Fantasy|Family,LV|BE|FR,tt4772188
