movie_id,title,original_title,overview,tagline,status,release_date,runtime,budget,revenue,popularity,vote_average,vote_count,original_language,genres,production_countries,imdb_id
109445,Frozen,Frozen,"Young princess Anna of Arendelle dreams about finding true love at her sister Elsa’s coronation. Fate takes her on a dangerous journey in an attempt to end the eternal winter that has fallen over the kingdom. She's accompanied by ice delivery man Kristoff, his reindeer Sven, and snowman Olaf. On an adventure where she will find out what friendship, courage, family, and true love really means.",Who will save the day? The ice guy? The nice guy? The snow man? Or no man?,Released,2013-11-20,102,150000000,1274219009,21.5692,7.249,17406,en,Animation|Family|Adventure|Fantasy,US,tt2294629
84654,Black Orchid,Black Orchid,"Caught in a loveless marriage, Dr. John Winnington (Ronald Howard) can't stop himself from falling for his wife's (Mary Laura Wood) younger sister, Christine (Olga Edwardes). But when he suddenly becomes the prime suspect in his wife's tragic murder, John relies on his friend Eric (John Bentley) to clear his name. This classic murder mystery encourages viewers to evaluate all of the clues and guess the killer's identity.",,Released,1953-02-01,58,0,0,21.5211,4.444,9,en,Mystery|Crime|Drama,GB,tt0243152
365083,Harvest Lake,Harvest Lake,"Five friends fall under the seductive influence of a libidinous, otherworldly presence that threatens to change their lives forever in this strange and erotic new film from director Scott Schirmer and producer Brian K. Williams.",Become One With Nature,Released,2016-03-11,75,0,0,21.4732,3.242,33,en,Horror,US,tt5129156
586068,Malibu,Malibú,Ernesto has found a peculiar way to meet people and earn a living: provoking car accidents.,,Released,2021-09-19,0,0,0,21.463,5.8,4,es,Drama|Action,MX,tt13535964
1586841,The Trip 8,El paseo 8,"After meeting in Paris, Rosa and Pierre, her French boyfriend, decided to travel to Colombia with the hope of celebrating their wedding and spending their honeymoon. But plans change after introducing the in-laws, who, driven by a bombshell secret, decide to stop the happy marriage at all costs. Amid absurd situations and a dog who, apparently, is the only sane one on the trip, the long-awaited honeymoon will end up turning into a real honeymoon from hell.",The bitter moon,Released,2025-12-25,91,0,0,21.4586,8.0,7,es,Comedy,CO,
757610,Katie: The Year of a Child,Katie: The Year of a Child,"Katie, the 14-year-old daughter of a travelling family, is left in charge of an ailing mother and her nine brothers and sisters in Dublin whilst her father is in England seeking his fortune.",,Released,1979-12-13,70,0,0,21.436,0.0,0,en,Drama|TV Movie,IE|GB,tt0771281
475762,Return to Justice,Return to Justice,Photojournalist Bo (Griffin O'Neal) and his girlfriend Angie (Tawny Fere) are captured and falsely imprisoned in Colombia. Angie's Sheriff / cowboy father Jethro (Richard Lynch) vows to use every method at his disposal to secure their freedom.,In the tradition of Midnight Express.,Released,1990-01-01,88,0,0,21.4313,5.4,5,en,Drama|Action,US|ZA,tt0152182
671318,¿Y Cómo Es Él?,¿Y Cómo Es Él?,"Thomas is a meek man on the verge of a nervous breakdown. Despite his situation he decides to fake a work trip to go to Vallarta to confront Jero, a taxi driver who is sleeping with his wife.",,Released,2022-04-07,95,0,1478358,21.3268,7.504,260,en,Comedy|Drama,US,tt8928230
345860,"The Rough, Tough West","The Rough, Tough West","Charles Starrett returns as the Durango Kid in Columbia's Rough, Tough, West. For most of the film, however, Starrett is known as ""Steve Holden,"" a former Texas Ranger who comes to a wide-open mining town to visit an old friend (Jack -- later Jock -- Mahoney). Alas, said friend has turned bad, and is busy arranging a major land grab when Steve arrives on the scene. With deep regret, our hero dons his Durango disguise to thwart his ex-friend's criminal activities.",,Released,1952-06-14,54,0,0,21.3189,5.5,2,en,Western|Music,US,tt0045107
1137618,The Rooster,The Rooster,"When the body of his oldest friend is found buried in a shallow grave, Dan, a small-town cop, seeks answers from a volatile hermit who was the last person to see his friend alive. As Dan gets closer to the truth, he must confront his own personal demons and he discovers that hope can be found in unlikely places.",,Released,2024-02-22,101,0,0,21.3017,5.647,17,en,Drama|Mystery,AU,tt21336930
372058,Your Name.,君の名は。,"High schoolers Mitsuha and Taki are complete strangers living separate lives. But one night, they suddenly switch places. Mitsuha wakes up in Taki’s body, and he in hers. This bizarre occurrence continues to happen randomly, and the two must adjust their lives around each other.","Separated by distance, connected by fate.",Released,2016-08-26,106,7500000,405320132,21.2655,8.479,12339,ja,Animation|Romance|Drama,JP,tt5311514
1492094,Every Time You Lose Your Mind: A Film About Failure,Every Time You Lose Your Mind: A Film About Failure,"Like a falling satellite blazing across the musical landscape, Failure flamed-out in the late ‘90s, their promising rise derailed by drug addiction. Every Time You Lose Your Mind documents the origins, downfall, and rebirth of the pioneering trio.",,Released,2025-06-26,117,0,0,21.2292,5.5,2,en,Music|Documentary,,
230858,The Parrot and the Swan,El loro y el cisne,"Loro, a sound recordist, meets Luciana, a dancer, and falls in love whit her.  When she quits their ballet production and leaves, Loro looks for her in San Francisco, Argentina.",,Released,2013-10-11,100,0,0,21.1723,7.0,6,es,,AR,tt2805254
800373,A Life for Movies: Lotte Eisner,Ein Leben für den Film - Lotte Eisner,"Born in Berlin in 1896, Lotte Eisner became famous for her passionate involvement in the world of both German and French cinema. In 1936, together with Henri Langlois, she founded the Cinémathèque Française with the goal of saving from destruction films, costumes, sets, posters, and other treasures of the 7th Art. A Jew exiled in Paris, she became a pillar of the capital's cultural scene, where she promoted German cinema.",,Released,2021-02-24,55,0,0,21.1703,8.5,2,de,Documentary,FR|DE,tt14101856
12482,Love Is Colder Than Death,Liebe ist kälter als der Tod,"Small-time pimp Franz is torn between his mistress and Bruno, the gangster sent after him by a shady crime syndicate he has refused to join.",,Released,1970-01-16,88,0,0,21.1557,6.2,57,de,Crime|Drama,DE,tt0064588
673,Harry Potter and the Prisoner of Azkaban,Harry Potter and the Prisoner of Azkaban,"Year three at Hogwarts means new fun and challenges as Harry learns the delicate art of approaching a Hippogriff, transforming shape-shifting Boggarts into hilarity and even turning back time. But the term also brings danger: soul-sucking Dementors hover over the school, an ally of the accursed He-Who-Cannot-Be-Named lurks within the castle walls, and fearsome wizard Sirius Black escapes Azkaban. And Harry will confront them all.",Something wicked this way comes.,Released,2004-05-31,141,130000000,789804554,21.1442,8.008,22902,en,Adventure|Fantasy,GB|US,tt0304141
2972,The Golem: How He Came Into the World,"Der Golem, wie er in die Welt kam","In 16th-century Prague, a rabbi creates the Golem - a giant creature made of clay. Using sorcery, he brings the creature to life in order to protect the Jews of Prague from persecution.",,Released,1920-10-29,85,0,0,21.1113,7.009,234,de,Fantasy|Horror,DE,tt0011237
728402,E se per caso una mattina...,E se per caso una mattina...,"A middle-aged man, married with children, leaves his family to follow a hippy girl. Among the girl's acquaintances there is a boy who is expert in making moccasins and the man tries to exploit him commercially. But the attempt fails and, since he has become jealous of the girl, the man kills the boy and the girl. Then he goes back to his family.",,Released,1972-07-25,82,0,0,21.1016,4.5,1,it,Comedy|Drama,IT,tt0207942
675982,Tres Romeos y una Julieta,Tres Romeos y una Julieta,,,Released,1961-01-01,85,0,0,21.0807,5.0,2,es,,MX,tt0237849
872585,Oppenheimer,Oppenheimer,The story of J. Robert Oppenheimer's role in the development of the atomic bomb during World War II.,The world forever changes.,Released,2023-07-19,181,100000000,952000000,21.0789,8.034,11447,en,Drama|History,GB|US,tt15398776
950396,The Gorge,The Gorge,"Two highly trained operatives grow close from a distance after being sent to guard opposite sides of a mysterious gorge. When an evil below emerges, they must work together to survive what lies within.",The world's most dangerous secret lies between them.,Released,2025-02-13,128,70000000,0,21.0718,7.625,3483,en,Romance|Science Fiction|Thriller,US,tt13654226
1196946,Ikkis,इक्कीस,"Second Lieutenant and India's youngest Param Vir Chakra recipient, Arun Khetarpal, gave his life fighting for his battalion and the country during the 1971 Battle of Basantar. Ikkis also takes a reflective look at the futility of war through the eyes of Khetarpal's father, who visits his ancestral home in Sargodha and Alma Mater for reunion, which now happens to be in post-partition Pakistan, 30 years later.","He was 21, will remain as that.",Released,2026-01-01,148,0,0,21.0632,5.9,11,hi,History|War|Drama,IN,tt15464188
803737,Who We Are: A Chronicle of Racism in America,Who We Are: A Chronicle of Racism in America,"Jeffery Robinson's talk on the history of U.S. anti-Black racism, with archival footage and interviews.",The enemy is us.,Released,2022-01-14,117,0,234217,21.0567,8.0,12,en,Documentary,US,tt14030682
687259,Ghost Stories,镜花风月三之螺女挑情,,,Released,1982-01-01,80,0,0,21.0189,6.2,2,zh,Horror,TW,
625119,The Spring Outside the Fence,竹籬笆外的春天,"The rebellious and free-spirited Li Lin and the introverted Wu Ai-hua are best friends who grow up together in the military dependents' village. However, they both fall in love with pilot He Kang, their mutual childhood friend. After He Kang is killed in a crash, the village only reminds the heartbroken girls of the tragedy. They escape to Taipei and work as hostess and accountant, earning a living from American soldiers on leave from Vietnam. The girls reunite with Michael, an American flight instructor, at the club. Michael ardently pursues Li Lin, but struggling to forget He Kang, Li Lin rejects Michael' s proposal. Having taken different paths, the two girls eventually return to their childhood village, reminiscing about the bonds of the past.",,Released,1985-08-10,112,0,0,20.9922,0.0,0,zh,Drama,TW,tt2732686
475557,Joker,Joker,"During the 1980s, a failed stand-up comedian is driven insane and turns to a life of crime and chaos in Gotham City while becoming an infamous psychopathic crime figure.",Put on a happy face.,Released,2019-10-01,122,55000000,1078958629,20.9769,8.127,27390,en,Crime|Thriller|Drama,CA|US,tt7286456
918505,The Fable of Higher Education That Was Too High for the Old Man,The Fable of Higher Education That Was Too High for the Old Man,"Buchanan Bartlett, shiftless son of Hiram Bartlett, farmer retired, is sent to college to learn things. Father becomes peeved when he receives a bill of expenditures a month later from his son, amounting to two hundred and fifty dollars. The old man decides to investigate things, and the following day finds him at the university.",,Released,1914-06-22,10,0,0,20.8965,0.0,0,en,Comedy,US,tt0003901
1112281,Cosa c’entra con l’amore,Cosa c’entra con l’amore,,,Released,1997-01-01,0,0,0,20.8951,0.0,0,it,Comedy,,tt0220374
276635,Experience Preferred... But Not Essential,Experience Preferred... But Not Essential,"A shy, introverted young girl takes a summer job at a seaside resort in Wales, where she finds the staff, the owners and patrons unlike anyone she has ever met before.",,Released,1982-12-22,80,0,822,20.8929,6.8,4,en,Comedy|TV Movie,GB,tt0083911
392733,Go Johnny Go,Go Johnny Go,"A 1997 Filipino comedy film starring Johnny Abarrientos, Rochelle Barrameda, and Willie Revillame.",,Released,1997-05-20,93,0,0,20.8928,0.0,0,tl,Comedy,PH,tt0377982
680,Pulp Fiction,Pulp Fiction,"A burger-loving hit man, his philosophical partner, a drug-addled gangster's moll and a washed-up boxer converge in this sprawling, comedic crime caper. Their adventures unfurl in three stories that ingeniously trip back and forth in time.",You won’t know the facts until you’ve seen the fiction.,Released,1994-09-10,154,8000000,213928762,20.8694,8.486,29797,en,Thriller|Crime|Comedy,US,tt0110912
1038392,The Conjuring: Last Rites,The Conjuring: Last Rites,Paranormal investigators Ed and Lorraine Warren take on one last terrifying case involving mysterious entities they must confront.,The case that ended it all.,Released,2025-09-03,136,55000000,499156445,20.8634,6.901,1679,en,Horror,US,tt22898462
308686,"Signed, Sealed, Delivered for Christmas","Signed, Sealed, Delivered for Christmas","With a duty to deliver every last letter before Christmas, the beloved quartet of post office detectives—Oliver, Shane, Rita and Norman—are working around the clock to redirect Santa’s mail just as Oliver runs into his former Sunday school teacher. When they receive an emotional last-minute plea not meant for Saint Nick, but instead written to God, they must delay their own travel plans to make sure one little girl doesn’t lose her Christmas joy—something Oliver and Shane are also struggling to find as they each face painful holiday memories. With a little guidance from a mysterious post office volunteer, Jordan, the Postables are more surprised than anyone to discover they've been a part of more than one miracle on this Christmas Eve.",,Released,2014-11-23,84,0,0,20.8266,6.672,32,en,Family|TV Movie,US,tt4065336
574475,Final Destination Bloodlines,Final Destination Bloodlines,"Plagued by a violent recurring nightmare, college student Stefanie heads home to track down the one person who might be able to break the cycle and save her family from the grisly demise that inevitably awaits them all.",Death runs in the family.,Released,2025-05-14,110,50000000,317854739,20.7918,7.057,2683,en,Horror|Mystery,US,tt9619824
878608,Resurrection,狂野时代,"In a future where humanity has surrendered its ability to dream in exchange for immortality, an outcast finds illusion, nightmarish visions, and beauty in an intoxicating world of his own making.","What is it that, once lost, you can never get back?",Released,2025-11-22,159,0,0,20.789,6.7,44,zh,Drama|Science Fiction|Fantasy,CN|FR,tt29002950
1280875,Fate/kaleid liner Prisma☆Illya 2wei!: Magical Girl in Hot Springs Inn,Fate/kaleid liner プリズマ☆イリヤ ツヴァイ! 魔法少女in温泉旅行,An OVA released between Fate/Kaleid Liner Prisma Illya 2Wei! and Fate/Kaleid Liner Prisma Illya 2Wei Herz!,,Released,2015-07-25,26,0,0,20.7626,10.0,1,ja,Animation|Fantasy|Comedy,,
298583,All Roads Lead to Rome,All Roads Lead to Rome,"Maggie is an uptight, single mother and college writing teacher from New York City. In an effort to reconnect with her troubled teen daughter Summer, she decides to embark on a journey to a Tuscan village where she frequented in her younger days. Upon arrival, Maggie runs into Luca a handsome former lover who is still a bachelor and lives with his eighty-year-old mother Carmen. Summer (missing her “bad boy” boyfriend in NYC) and Carmen (secretly planning a wedding against Luca’s wishes to MARCELINO, her one true love in Rome) impulsively steal Luca’s car and race off to Rome. Maggie and Luca quickly pursue allowing the two mismatched couples to spend some time together and develop a new understanding of each other.",Sometimes first love deserves a second chance...,Released,2016-01-14,90,0,0,20.745,5.0,262,en,Comedy|Romance,IT|US,tt4119278
13564,Return to House on Haunted Hill,Return to House on Haunted Hill,"Eight years have passed since Sara Wolfe and Eddie Baker escaped the House on Haunted Hill. Now the kidnapped Ariel, Sara's sister, goes inside the house with a group of treasure hunters to find the statue of Baphomet, worth millions and believed to be the cause of the House's evil.",,Released,2007-10-03,81,0,0,20.7409,5.478,321,en,Horror|Thriller,US|BG,tt0827782
1100988,28 Years Later,28 Years Later,"Twenty-eight years after the Rage virus outbreak, a heavily-defended island survives connected to the mainland by a single causeway. When one of the group leaves the island into the dark heart of the mainland, he discovers secrets, wonders, and horrors that have mutated not only the infected but other survivors as well.",Time didn't heal anything.,Released,2025-06-18,115,60000000,151308832,20.7381,6.609,2297,en,Horror|Thriller|Science Fiction,GB|US,tt10548174
50193,Joan Lui,Joan Lui - ma un giorno nel paese arrivo io di lunedì,"In a world ravaged by violence, and other serious social problems, Joan - a character that alludes to Christ (which represents the return to Earth) arrives to Italy by train and preaching for the salvation of mankind, condemning the hypocrisy and hedonism.",One day I will come and it will be on a Monday.,Released,1985-12-25,163,0,0,20.7362,5.2,30,it,Music|Adventure|Fantasy,DE|IT,tt0089375
1184918,The Wild Robot,The Wild Robot,"After a shipwreck, an intelligent robot called Roz is stranded on an uninhabited island. To survive the harsh environment, Roz bonds with the island's animals and cares for an orphaned baby goose.",Discover your true nature.,Released,2024-09-12,102,78000000,331982078,20.725,8.311,5790,en,Animation|Science Fiction|Family|Adventure,US,tt29623480
672,Harry Potter and the Chamber of Secrets,Harry Potter and the Chamber of Secrets,"Cars fly, trees fight back, and a mysterious house-elf comes to warn Harry Potter at the start of his second year at Hogwarts. Adventure and danger await when bloody writing on a wall announces: The Chamber Of Secrets Has Been Opened. To save Hogwarts will require all of Harry, Ron and Hermione's magical abilities and courage.",Something evil has returned to Hogwarts!,Released,2002-11-13,161,100000000,876688482,20.7193,7.704,23317,en,Adventure|Fantasy,GB|US|DE,tt0295297
1220564,The Secret Agent,O Agente Secreto,"Brazil, 1977. Marcelo, a technology expert in his early 40s, is on the run. Hoping to reunite with his son, he travels to Recife during Carnival but soon realizes that the city is not the safe haven he was expecting.","Brazil 1977, a time of great mischief.",Released,2025-07-23,161,5000000,14532477,20.7128,7.4,461,pt,Crime|Drama|Thriller,BR|FR|DE|NL|AR,tt27847051
799130,Redeemed,Redeemed,"After becoming the youngest female, minority judge elevated to the bench in her state, Angela Sylvester quickly finds herself trapped into a 'Kids for Pay' prison scam orchestrated by her boss.",The justified will rise.,Released,2021-02-18,79,0,0,20.7068,9.7,3,en,Drama,US,tt8170712
443547,Erasing Eden,Erasing Eden,A young woman sabotages her own wedding in order to reclaim her identity and obliterates her life in the process.,The truth can be messy,Released,2016-10-15,90,0,0,20.6223,4.0,6,en,Drama,US,tt2516326
1107940,Sunset: The Mystery of the Necklace of São Cajó,Pôr do Sol - O Mistério do Colar de São Cajó,"Follows the Bourbon de Linhaça family and their precious Necklace of São Cajó, that's been in the family for over 3500 years and hides secrets, curses and a mythical cod recipe.",,Released,2023-08-03,112,0,0,20.6191,7.0,7,pt,Comedy|Mystery,PT,tt24634274
516467,Die große und die kleine Welt,Die große und die kleine Welt,,,Released,1921-04-28,0,0,0,20.6115,0.0,0,de,Drama,DE,tt0129971
87826,Here Comes the Boom,Here Comes the Boom,A high school biology teacher moonlights as a mixed-martial arts fighter in an effort to raise money to save the school's music program.,No one will fight for his students like Mr. Voss.,Released,2012-10-10,105,42000000,73100000,20.5922,6.218,1554,en,Comedy|Action|Drama,US,tt1648179
66795,Infection: The Invasion Begins,Infection: The Invasion Begins,"A mystery surrounds a small town that was attacked on September 9, 2009. Now sixty years later, the last survivor, Sarah, sends a high profile reporter a letter suggesting what really happened on that day. The government calls 9/9/09 the start of the ""Modern Plague"", and the reporter soon realizes that the truth may be harder to uncover than the lies.",Don't look to the skies...the invaders are inside us!,Released,2010-01-04,95,0,0,20.5455,2.8,10,en,Horror|Science Fiction,US,tt1386583
68718,Django Unchained,Django Unchained,"With the help of a German bounty hunter, a freed slave sets out to rescue his wife from a brutal Mississippi plantation owner.","Life, liberty, and the pursuit of vengeance.",Released,2012-12-25,165,100000000,425368238,20.5439,8.187,27663,en,Drama|Western,US,tt1853728
361790,No One Loves Anyone For More Than Two Years,Ninguém Ama Ninguém por Mais de Dois Anos,"""No one loves anyone for more than two years"" is an adaptation of Nelson Rodrigues' work about five couples that live in Brazil in the early 60's, who are seen by the society as conventional people, but whose intimate lives turn out to be morally questionable.",,Released,2015-11-12,88,0,0,20.5353,5.917,12,pt,Drama|Romance|Comedy,BR,tt5532160
822100,A Choice of Weapons: Inspired by Gordon Parks,A Choice of Weapons: Inspired by Gordon Parks,"This documentary chronicles renaissance man Gordon Parks’ stellar career from staff photographer for LIFE magazine, through his artistic development photographing everyday Americans, through his evolution as a novelist and groundbreaking filmmaker.",The new generation of artists shaped by a legend.,Released,2021-06-18,89,0,0,20.5133,6.8,19,en,Documentary,US,tt14495394
401571,Padre nuestro que estas en la tierra,Padre nuestro que estas en la tierra,Single father with a disability struggles to raise his son.,,Released,1972-09-28,90,0,0,20.5097,5.0,2,es,Drama,MX,tt0323549
58087,Amarsi un po'...,Amarsi un po'...,"In an accident the young mechanic Marco Coccia meets Cristiana. The two fall in love with one another. Cristiana confesses only later that she is a genuine princess. For Marco it is not a problem, but for Cristiana's parents it is a very big problem. The two must separate. When one evening Cristiana calls Marco and lets him know about her forthcoming wedding, Marco with the car races toward Paris and has an accident...",,Released,1984-10-05,93,0,0,20.498,6.284,51,it,Comedy,IT,tt0086881
72105,Ted,Ted,"John Bennett, a man whose childhood wish of bringing his teddy bear to life came true, now must decide between keeping the relationship with the bear or his girlfriend, Lori.",Ted is coming.,Released,2012-06-29,107,50000000,549368315,20.4843,6.448,13008,en,Comedy|Fantasy,US,tt1637725
1266990,Kulong,Kulong,"Three friends retreat to a resort to collaborate on a daring screenplay for a contest. Faced with the challenge of writing about passion despite their own dry spells, their journey soon blurs the line between imagination and experience.",,Released,2024-05-24,48,0,0,20.4698,6.433,15,tl,Drama,PH,tt32164798
150046,Winter A-Go-Go,Winter A-Go-Go,"Teenagers work, play, and dance to rock 'n' roll at the Lake Tahoe ski lodge.",Ski Buffs and Ski Babes on the Go-Go in the Snow-Snow!,Released,1965-10-28,88,0,0,20.4643,4.8,2,en,Music|Comedy,,tt0059916
643776,Cu Li Never Cries,Cu li không bao giờ khóc,"A woman tries to cling onto dimming links to her past after inheriting a pygmy slow loris from her long-estranged husband; meanwhile, her niece prepares for marriage as the young couple ponders their gloomy future together. The present and the complex echoes of Vietnamese history are entwined before a contemplative and poetic perspective.","They say, live in the now as much as you can. But the past returns regardless. Unwhole. Fragmented. Existing in pieces of experience.",Released,2024-11-15,93,572000,28350,20.4569,8.0,1,vi,Drama,FR|NO|PH|SG|VN,tt30953660
381656,Unmistaken Hands: Ex Voto F.H.,Unmistaken Hands: Ex Voto F.H.,"In a realm beyond the senses, plants interact with surreal cinematography to chart the course of our character: an entity said to embody the life and work of Felisberto Hernández, Uruguayan father of magical realism. Through this journey, we are confronted with an open-ended experience questioning the nature of musicality versus cinematography, entity versus aberration, and self versus space, in a self-referential, blurry, digital and mystical setting.",,Released,2013-11-01,26,0,0,20.4467,6.071,7,en,Animation|Drama|Fantasy,GB|US,tt3158440
137051,Midnight Matinee,Midnight Matinee,"Even though a devastating murder took place during a small town's horror film festival two years earlier, townspeople want another festival.",Every mystery has its clues,Released,1988-10-12,91,0,0,20.4362,5.0,6,en,Horror|Mystery|Thriller|TV Movie,CA,tt0095602
272417,I Lost My Heart to a Turk,Bir Türk'e Gönül Verdim,"I Lost My Heart to a Turk is the story of a German woman Eva Bender, who is deserted by a Turkish worker in Germany five years earlier and left alone with a child Zafer. Eva's father refuses his illegitimate grandson from a Turkish worker. She comes to Kayseri, Turkey with her illegitimate child to seek her lover, Ismail Acar. Ismail is now working at Sümer Cotton Cloth factory as a mechanic and establishing a small private business. Eva finds her ex-lover Ismail who now lives with his wife and children. Humiliated by her ex-lover, the German woman receives assistance by another Turkish worker, Mustafa.",,Released,1969-01-01,90,0,0,20.402,6.5,1,tr,Drama,TR,tt0274381
242161,Casseta & Planeta: A Taça do Mundo é Nossa!,Casseta & Planeta: A Taça do Mundo é Nossa!,"A satire about the dictatorship period in Brazil, in which communist militants try to steal the soccer World Cup Trophy from the players Pelé and Carlos Alberto Torres.",,Released,2003-11-21,90,0,0,20.4019,4.529,17,pt,Comedy,BR,tt0354087
